created_at,favorite_count,retweet_count,text
2021-02-16 00:43:52,1287,95,Using the day off to do some writing/thinking about the future. Good way to clarify thinking is to force yourself to write something down (concisely/clearly) in a few pages.
2021-02-12 03:32:37,94,2,@CJMcCollum @CoinbasePro Taking a look with @CoinbaseSupport ! Apologies for the trouble
2021-02-10 23:55:43,36,5,"🤔🤔 https://t.co/rOfj6rMOCb
🤔🤔🤔 https://t.co/lF4TxmAknH"
2021-02-10 23:54:38,110,14,🤔 https://t.co/BuCglxNJHj
2021-02-10 18:52:07,189,21,"Thank you @tylercowen for having me on the podcast. Enjoyed the conversation! 

https://t.co/QmqvlMrqjU"
2021-02-10 00:08:31,74,0,"@sadbryce Thank you Bryce! It has been amazing to work with you. Best of luck on your next adventure, and stay in touch 🙏"
2021-02-09 18:21:53,982,61,"Pre ordered Starlink.

It’s amazing how often internet still disconnects in 2021. Redundant connections to every home would increase reliability.

If one power plant goes offline, (at least in theory) your house shouldn’t lose electricity. Other power plants pick up the slack..."
2021-01-29 19:26:16,1209,77,"@APompliano I don't want people to misunderstand the reason behind this, we are working on scaling https://t.co/KYLMHuPydm"
2021-01-29 18:49:23,374,43,"Organizations (whether companies, non-profits, governments, individuals, etc) hosting the #Bitcoin whitepaper are waving a flag saying: we are technological progressives, committed to building the future through science and technology, working for team human."
2021-01-29 18:46:20,3320,443,"We are now hosting the #Bitcoin whitepaper at https://t.co/ia5WJ1B3CK

This brilliant computer science breakthrough sparked an entire industry that is bringing economic freedom to the world. Read it - even if it you have to read it 30 times to fully understand it like I did."
2021-01-29 18:34:50,257,46,It's time to build! https://t.co/8jjy39j7TU
2021-01-29 15:00:23,579,43,"Thank you @FrancisSuarez for driving crypto adoption in the great city of Miami, and being so positive, welcoming, and focused on the future + economic growth. https://t.co/vYnESuQFHi"
2021-01-28 16:13:02,1395,239,This is awesome to see https://t.co/HOrlzxXKNZ
2021-01-25 17:00:32,77,14,Where will everyone be locating after COVID? Quick survey! https://t.co/2zAIXmLKea
2021-01-20 23:01:06,265,9,@souljaboy Happy to help @coinbase - send me a DM if you'd like to chat 🙏
2021-01-19 21:56:38,268,23,Excited to welcome the @BisonTrails team to Coinbase! https://t.co/rZXgPNhj40
2021-01-14 19:11:32,389,47,"I also hope the next administration will hit the reset button on this and engage more thoughtfully with industry.

A great step for now. https://t.co/pB9i0S74Ha"
2021-01-12 01:08:27,74,2,@MMARoasted @CoinbasePro @coinbase @CoinbaseSupport Will have the team take a look - sorry for the trouble!
2021-01-12 00:00:25,388,32,"Would not surprise me if @paradigm was one of the top performing funds of the last few years if not #1. Not just because of recent crypto prices (lots rode those), but the early stage companies they invested in. Someone should check....who does leaderboards for such things?"
2021-01-05 12:15:48,158,24,Well said @fredwilson ! https://t.co/J6g0uykU2V
2021-01-05 07:21:43,52,11,Interesting read: https://t.co/ve5SYUVAIr
2021-01-05 07:21:19,274,48,https://t.co/NcgBAvOqgm
2021-01-05 07:20:27,297,51,Square also opposing this regulation as ill conceived - seems to be unanimous from the industry at this point. https://t.co/vxShNNCVXP
2021-01-05 07:19:11,53,5,"AML risks here are negligible vs other methods and regs here have a high probability of harming American, including potentially losing our status as a financial hub long term.

Thoughtful regulation should have a hippocratic oath - first do no harm."
2021-01-05 07:17:48,64,6,"It's ill advised and didn't follow proper procedure. FinCEN should revisit in the new administration, engaging with industry, if it still wants to pursue something in this area. It's not even clear they should btw..."
2021-01-05 07:15:13,253,39,"Well said! Thank you @katie_haun and @a16z 

Btw, Katie is a former federal prosecutor! She would not propose challenging this in court unless she felt there was a strong case. Coinbase intends to join A16Z in challenging this in court, if it goes through. https://t.co/8O6Ayzpnbh"
2021-01-04 12:56:44,88,40,https://t.co/N86a87mdoB
2021-01-04 12:56:40,85,8,"I forgot to mention Oculus Quest 2, M1 chip from Apple, 5G rollout, self driving, synthetic meat, improvements in batteries/solar, longevity, etc etc."
2021-01-04 09:21:55,217,36,https://t.co/CxDrpKPNLz
2021-01-03 06:38:38,181,17,@zooko Thank you @zooko for everything you've done to advance crypto as well!
2021-01-01 14:24:30,153,46,"Fascinating post https://t.co/GH5YawJEgS

Explains the covid vaccines from a computer science perspective."
2021-01-01 12:22:52,558,27,Well deserved! Thank you for introducing so many people to Bitcoin https://t.co/j5iAtbrEnn
2020-12-31 17:25:50,165,27,"mRNA vaccines, Starlink, GPT-3, crypto, ISS docking, and so much more.

Progress continues!

https://t.co/K0wajxS58O"
2020-12-31 17:24:11,666,43,"Happy new year! Excited for the rest of the decade, and a repeat of the roaring 20's.

Whatever doesn't kill us makes us stronger. Despite a tough year, science and technology had so many advances that we will emerge better."
2020-12-31 17:08:34,58,3,"For example, MarkMonitor is used to secure some high value domains, CloudFlare is good. Even Google Domains. Etc."
2020-12-31 17:06:44,178,29,"Crypto companies should take precautions, using a secure dns and domain registrar service, to prevent attacks like this.

https://t.co/lA3NKO2oUC"
2020-12-29 15:12:44,421,88,"Everyone who owns crypto should start to be actively engaged on these issues.

An open crypto network is good for the world, it would be a real shame to have it's potential cut off with bad policy.

This last month has shown how much work we have to do on education/advocacy. https://t.co/wPnSfFfQjO"
2020-12-29 15:04:30,392,56,"A fable worth reading, lesson hiding in plain sight 

https://t.co/7WUP7dYZvH"
